Title; MainImagePath; Name; IsActive; Cost
Ирисовый освежающий увлажняющий крем; Товары салона красоты\1953276-1.jpg; Weleda; 1; 720
Сыворотка для кожи вокруг глаз с гиалуроновой кислотой; Товары салона красоты\9631447-1.jpg; DIONY; 1; 690
Тоник для лица дневной, Витаминный; Товары салона красоты\7293278-1.jpg; Natura Botanica; 1; 800
Массажный крем для лица с увлажняющим и тонизирующим эффектом; Товары салона красоты\6556449-1.jpg; AMSARVEDA; 1; 740
Маска-пленка отшелушивающая с лифтинг-эффектом; Товары салона красоты\6556452-1.jpg; AMSARVEDA; 1; 860
Специальный крем для клеточного восстановления; Товары салона красоты\6556466-1.jpg; AMSARVEDA; 0; 920
Увлажняющий крем; Товары салона красоты\1781678-1.jpg; Weleda; 0; 730
Восстанавливающая маска для лица; Товары салона красоты\3432465-1.jpg; ANDALOU; 0; 630
Крем SILK для чувствительной кожи лица натуральный; Товары салона красоты\9939701-1.jpg; MATSESTA; 1; 740
Подарочный набор Сияние; Товары салона красоты\6964198-1.jpg; Natura Botanica; 1; 630
Пена для бритья Натуральная, Лимон и Корица; Товары салона красоты\7528034-1.jpg; Natura Botanica; 1; 470
Крем питательный тонизирующий ночной; Товары салона красоты\3388879-1.jpg; BIOSelect; 1; 950
Подарочный набор Супер Увлажнение; Товары салона красоты\6964197-1.jpg; Natura Botanica; 1; 830
Подарочный набор Глубокое Очищение; Товары салона красоты\6964196-1.jpg; Natura Botanica; 1; 860
Тоник ACTIVE для возрастной кожи лица натуральный; Товары салона красоты\9939709-1.jpg; MATSESTA; 1; 720
Эфирное масло мелиссы; Товары салона красоты\7064333-1.jpg; Natura Botanica; 1; 380
Увлажняющая эмульсия для лица; Товары салона красоты\6556463-1.jpg; AMSARVEDA; 1; 910
Масло персиковое; Товары салона красоты\6691688-1.jpg; Natura Botanica; 1; 280
Очищающая коллекция Ночной восстанавливающий крем для лица; Товары салона красоты\3432453-1.jpg; ANDALOU; 1; 570
Подарочный набор For HIM, Сильный мужчина; Товары салона красоты\7299377-1.jpg; Natura Botanica; 1; 900
Антивозрастная коллекция Освежающий тоник Цветочный; Товары салона красоты\3432442-1.jpg; ANDALOU; 1; 940
Розовый разглаживающий увлажняющий крем; Товары салона красоты\1781679-1.jpg; Weleda; 1; 890
Деликатный питательный крем; Товары салона красоты\1781676-1.jpg; Weleda; 1; 890
Масло сладкого миндаля; Товары салона красоты\6691687-1.jpg; Natura Botanica; 1; 250
Эфирное масло жасмин; Товары салона красоты\7064330-1.jpg; Natura Botanica; 1; 610
Натуральная пенка для умывания, с ароматом розового дерева; Товары салона красоты\6953177-1.jpg; Natura Botanica; 0; 750
Тоник для лица, для сухой и нормальной кожи; Товары салона красоты\9631443-1.jpg; DIONY; 1; 490
Эфирное масло лемонграсс; Товары салона красоты\7064323-1.jpg; Natura Botanica; 1; 380
Ирисовый освежающий ночной крем; Товары салона красоты\1781674-1.jpg; Weleda; 1; 840
Деликатное очищающее молочко; Товары салона красоты\1781675-1.jpg; Weleda; 1; 680
Эфирное масло корицы; Товары салона красоты\7064335-1.jpg; Natura Botanica; 1; 370
Очищающий гель для умывания; Товары салона красоты\7847906-1.jpg; Weleda; 0; 720
Солнцезащитный лосьон для лица и тела; Товары салона красоты\6556469-1.jpg; AMSARVEDA; 1; 830
Коллекция Кокосовая, Очищающая пенка для лица с экстрактами кактуса; Товары салона красоты\3472602-1.jpg; ANDALOU; 1; 540
S.O.S. средство против локальных несовершенств кожи; Товары салона красоты\7847905-1.jpg; Weleda; 1; 870
Коллекция Сияние, Очищающая крем-пенка Лимон Мейера; Товары салона красоты\3472591-1.jpg; ANDALOU; 1; 750
Подарочный набор Сияние и Красота; Товары салона красоты\6964199-1.jpg; Natura Botanica; 1; 570
Маска-пленка для глубокого очищения пор; Товары салона красоты\6556453-1.jpg; AMSARVEDA; 1; 920
Ирисовый освежающий дневной крем; Товары салона красоты\1781693-1.jpg; Weleda; 1; 740
Деликатный увлажняющий крем; Товары салона красоты\1781680-1.jpg; Weleda; 1; 940
Ухаживающее масло, против сухости кожи; Товары салона красоты\6953160-1.jpg; Natura Botanica; 1; 410
Розовое растительное мыло; Товары салона красоты\1781711-1.jpg; Weleda; 1; 470
Гранатовый дневной крем-лифтинг; Товары салона красоты\1781695-1.jpg; Weleda; 1; 800
Тонизирующее очищающее средство 2 в 1; Товары салона красоты\2008488-1.jpg; Weleda; 1; 640
Сыворотка для лица с гиалуроновой кислотой, для сухой и чувствительной кожи; Товары салона красоты\9631448-1.jpg; DIONY; 0; 590
Эфирное масло лимона; Товары салона красоты\7064322-1.jpg; Natura Botanica; 1; 330
Эфирное масло розовое дерево; Товары салона красоты\7064326-1.jpg; Natura Botanica; 0; 510
Мягкая пенка для умывания; Товары салона красоты\5625224-1.jpg; Weleda; 0; 680
Сыворотка для лица с гиалуроновой кислотой, для нормальной кожи; Товары салона красоты\9631445-1.jpg; DIONY; 1; 560
Тоник для лица, для жирной и проблемной кожи; Товары салона красоты\9631442-1.jpg; DIONY; 1; 600
Пенка для умывания, для сухой и чувствительной кожи; Товары салона красоты\9631439-1.jpg; DIONY; 1; 440
Антивозрастной крем для лица с органическими ягодами годжи; Товары салона красоты\6433981-1.jpg; Blue Beautifly; 0; 990
Эфирное масло эвкалипт; Товары салона красоты\7064320-1.jpg; Natura Botanica; 1; 410
Сыворотка PERFECT SERUM депигментирующая натуральная; Товары салона красоты\9939719-1.jpg; MATSESTA; 1; 710
Крем для лица с антиоксидантами органической клюквы; Товары салона красоты\6433979-1.jpg; Blue Beautifly; 0; 980
Пенка для лица для чувствительной кожи; Товары салона красоты\3472601-1.jpg; ANDALOU; 1; 630
Коллекция Кокосовая, Укрепляющая сыворотка с экстрактами кактуса; Товары салона красоты\3472604-1.jpg; ANDALOU; 1; 680
Крем-маска WOW EFFECT омолаживающая для лица натуральная; Товары салона красоты\9939704-1.jpg; MATSESTA; 1; 950
Подарочный набор For MEN; Товары салона красоты\7299378-1.jpg; Natura Botanica; 1; 840
Очищающий гель для нормальной и сухой кожи лица; Товары салона красоты\6556458-1.jpg; AMSARVEDA; 1; 720
Лифтинг-сыворотка для лица; Товары салона красоты\6556462-1.jpg; AMSARVEDA; 0; 930
Тоник для ухода за сухой и нормальной кожей; Товары салона красоты\6556459-1.jpg; AMSARVEDA; 1; 990
Питательный крем для лица; Товары салона красоты\6556464-1.jpg; AMSARVEDA; 0; 800
Крем против морщин для глаз; Товары салона красоты\5427580-1.jpg; BIOSelect; 0; 570
Лифтинг-сыворотка для лица с гиалуроновой кислотой; Товары салона красоты\9631446-1.jpg; DIONY; 1; 610
Деликатное питательное масло для лица; Товары салона красоты\2262226-1.jpg; Weleda; 1; 930
Тонизирующая сыворотка для лица; Товары салона красоты\6556461-1.jpg; AMSARVEDA; 1; 780
Масло праймер для лица (основа под макияж), Выравнивание; Товары салона красоты\6953159-1.jpg; Natura Botanica; 1; 530
Сыворотка COUPEROSE укрепляющая сосуды натуральная; Товары салона красоты\9939714-1.jpg; MATSESTA; 1; 590
Органический тонер с экстрактом Розы; Товары салона красоты\7889950-1.jpg; Blue Beautifly; 1; 960
Пенка для умывания, для жирной и комбинированной кожи; Товары салона красоты\9631437-1.jpg; DIONY; 1; 780
Маска для лица увлажняющая и тонизирующая; Товары салона красоты\6556451-1.jpg; AMSARVEDA; 1; 860
Эфирное масло чайного дерева; Товары салона красоты\7064334-1.jpg; Natura Botanica; 1; 410
Очищающий гель для комбинированной и жирной кожи лица; Товары салона красоты\6556457-1.jpg; AMSARVEDA; 1; 980
Масло после бритья Натуральное, Лимон и Корица; Товары салона красоты\7528031-1.jpg; Natura Botanica; 1; 300
Ухаживающее масло для лица, восстанавливает кожу; Товары салона красоты\6953176-1.jpg; Natura Botanica; 1; 420
Подарочный набор Мягкое Очищение; Товары салона красоты\6964195-1.jpg; Natura Botanica; 1; 850
Гранатовый ночной крем-лифтинг; Товары салона красоты\1781696-1.jpg; Weleda; 1; 560
Живительный тоник для лица; Товары салона красоты\2008486-1.jpg; Weleda; 0; 770
Универсальный питательный крем SKIN FOOD; Товары салона красоты\2351755-1.jpg; Weleda; 1; 640
Органическое 100% аргановое масло; Товары салона красоты\6433982-1.jpg; Blue Beautifly; 1; 760
Пенка для умывания, для нормальной кожи; Товары салона красоты\9631438-1.jpg; DIONY; 1; 400
Крем PERFECT выравнивающий тон лица натуральный; Товары салона красоты\9939700-1.jpg; MATSESTA; 1; 780
Чистящая пена-гель для лица; Товары салона красоты\2697586-1.jpg; BIOSelect; 1; 550
Пенка для умывания Натуральная, Лимон и корица; Товары салона красоты\7528032-1.jpg; Natura Botanica; 1; 280
Масло для лица массажное, с эффектом Лифтинга; Товары салона красоты\6953169-1.jpg; Natura Botanica; 0; 500
Увлажняющий 24-часовой крем против морщин; Товары салона красоты\2697576-1.jpg; BIOSelect; 1; 910
Подарочный набор Travel, в Командировку, мужской; Товары салона красоты\7299376-1.jpg; Natura Botanica; 1; 880
Тоник для ухода за жирной и комбинированной кожей; Товары салона красоты\6556460-1.jpg; AMSARVEDA; 1; 800
Тонизирующий крем для лица; Товары салона красоты\6556465-1.jpg; AMSARVEDA; 1; 800
Восстанавливающий крем для лица с органическим шиповником; Товары салона красоты\6433984-1.jpg; Blue Beautifly; 1; 960
Эфирное масло перечной мяты; Товары салона красоты\7064324-1.jpg; Natura Botanica; 0; 390
Тоник для лица, Успокаивающий, для всех типов кожи; Товары салона красоты\6953158-1.jpg; Natura Botanica; 1; 410
Эфирное масло бергамота; Товары салона красоты\7064315-1.jpg; Natura Botanica; 1; 380
Гималайская грязевая маска восстанавливающая; Товары салона красоты\6556455-1.jpg; AMSARVEDA; 1; 640
Эфирное масло лаванды; Товары салона красоты\7064314-1.jpg; Natura Botanica; 1; 570
Гималайская грязевая маска антиоксидантная; Товары салона красоты\6556454-1.jpg; AMSARVEDA; 1; 660
Гранатовая интенсивная сыворотка-лифтинг; Товары салона красоты\1781670-1.jpg; Weleda; 1; 720
Коллекция Кокосовая, Увлажняющий ночной крем с экстрактами кактуса; Товары салона красоты\3472608-1.jpg; ANDALOU; 1; 700
Тоник-пилинг для лица EXFOLIANT на основе фруктовых кислот натуральный; Товары салона красоты\9939710-1.jpg; MATSESTA; 1; 660
